{
  "schemaVersion": "1.0.0",
  "id": "01H00000000000000000000000",
  "tenantId": "tenant-demo",
  "workspaceId": "01H00000000000000000000001",
  "projectId": "01H00000000000000000000002",
  "title": "Q3 Product Review",
  "slug": "q3-product-review",
  "revision": 4,
  "branch": "main",
  "brandKitId": "01H00000000000000000000003",
  "themeId": "01H00000000000000000000004",
  "settings": {
    "defaultSlideRatio": { "ratioW": 16, "ratioH": 9 },
    "grid": { "size": 8, "color": { "colorSpace": "srgb", "value": "#e3e3e3" } },
    "snapToGrid": true,
    "showRulers": true
  },
  "variables": [{ "name": "audience", "type": "string", "default": "executive" }],
  "slides": [
    {
      "id": "01H00000000000000000000005",
      "semanticId": "intro",
      "position": 0,
      "title": "Intro",
      "aspect": { "ratioW": 16, "ratioH": 9 },
      "background": {
        "fill": { "color": { "colorSpace": "srgb", "value": "#0F172A" } }
      },
      "elements": [
        {
          "id": "01H00000000000000000000006",
          "semanticId": "cover",
          "type": "frame",
          "name": "Cover Frame",
          "parentId": null,
          "aspect": { "ratioW": 16, "ratioH": 9 },
          "clipContent": true,
          "transform": { "x": 0, "y": 0, "w": 1920, "h": 1080, "rotation": 0, "scale": 1 }
        },
        {
          "id": "01H00000000000000000000007",
          "semanticId": "title",
          "type": "text",
          "name": "Title",
          "parentId": null,
          "z": 1,
          "transform": { "x": 120, "y": 360, "w": 1680, "h": 200, "rotation": 0, "scale": 1 },
          "text": {
            "content": "Q3 Product Review",
            "runs": [
              {
                "start": 0,
                "end": 17,
                "style": { "fontFamily": "Inter", "fontSize": 96, "fontWeight": 700 }
              }
            ]
          },
          "style": { "fill": { "color": { "colorSpace": "srgb", "value": "#FFFFFF" } } }
        },
        {
          "id": "01H00000000000000000000008",
          "semanticId": "subtitle",
          "type": "text",
          "name": "Subtitle",
          "parentId": null,
          "z": 2,
          "transform": { "x": 120, "y": 600, "w": 1680, "h": 80, "rotation": 0, "scale": 1 },
          "text": { "content": "Prepared for the leadership team." }
        },
        {
          "id": "01H00000000000000000000020",
          "semanticId": "accent_line",
          "type": "vector",
          "name": "Accent line",
          "parentId": null,
          "z": 3,
          "transform": { "x": 120, "y": 720, "w": 320, "h": 4, "rotation": 0, "scale": 1 },
          "paths": ["M0,2 L320,2"],
          "stroke": { "color": { "colorSpace": "srgb", "value": "#60A5FA" }, "width": 4 }
        }
      ]
    },
    {
      "id": "01H00000000000000000000009",
      "semanticId": "metrics",
      "position": 1,
      "title": "Metrics",
      "aspect": { "ratioW": 9, "ratioH": 16 },
      "background": {
        "fill": { "color": { "colorSpace": "srgb", "value": "#F8FAFC" } }
      },
      "elements": [
        {
          "id": "01H00000000000000000000010",
          "semanticId": "row_cluster",
          "type": "group",
          "name": "Metric cluster",
          "parentId": null,
          "z": 0,
          "transform": { "x": 0, "y": 0, "w": 0, "h": 0, "rotation": 0, "scale": 1 }
        },
        {
          "id": "01H00000000000000000000011",
          "semanticId": "metric_stack",
          "type": "autoLayout",
          "name": "Auto-layout container",
          "parentId": null,
          "z": 1,
          "transform": { "x": 40, "y": 200, "w": 800, "h": 600, "rotation": 0, "scale": 1 },
          "autoLayout": {
            "direction": "vertical",
            "primaryAlign": "space-between",
            "counterAlign": "stretch",
            "itemSpacing": 16,
            "wrap": "no-wrap"
          }
        },
        {
          "id": "01H00000000000000000000012",
          "semanticId": "primary_kpi",
          "type": "frame",
          "name": "Primary KPI",
          "parentId": null,
          "z": 2,
          "transform": { "x": 60, "y": 240, "w": 360, "h": 160, "rotation": 0, "scale": 1 },
          "aspect": { "ratioW": 9, "ratioH": 4 },
          "componentInstance": {
            "componentId": "01H00000000000000000000013",
            "overrides": {
              "label": "Quarterly revenue",
              "value": "$12.4M",
              "trend": "up"
            }
          }
        },
        {
          "id": "01H00000000000000000000014",
          "semanticId": "trend_chart",
          "type": "image",
          "name": "Trend chart asset",
          "parentId": null,
          "z": 3,
          "transform": { "x": 60, "y": 460, "w": 720, "h": 360, "rotation": 0, "scale": 1 },
          "assetId": "asset-trend-chart-q3",
          "fit": "cover",
          "alt": "Quarter-over-quarter revenue trend line chart."
        },
        {
          "id": "01H00000000000000000000015",
          "semanticId": "revenue_by_region",
          "type": "vector",
          "name": "Revenue by region chart",
          "parentId": null,
          "z": 4,
          "transform": { "x": 60, "y": 860, "w": 720, "h": 320, "rotation": 0, "scale": 1 },
          "paths": ["M0,160 L120,80 L240,140 L360,40 L480,120 L600,20 L720,60"],
          "fill": { "color": { "colorSpace": "srgb", "value": "#3B82F6" } }
        },
        {
          "id": "01H00000000000000000000016",
          "semanticId": "boolean_shape",
          "type": "boolean",
          "name": "Boolean shape",
          "parentId": null,
          "z": 5,
          "transform": { "x": 60, "y": 1180, "w": 720, "h": 120, "rotation": 0, "scale": 1 },
          "operation": "union",
          "operands": ["01H00000000000000000000014", "01H00000000000000000000015"]
        }
      ]
    }
  ],
  "extensions": {
    "yjsPendingOps": []
  }
}
